{
  "$schema": "https://json-schema.org/draft/2020-12/schema",
  "$id": "https://github.com/squid-protocol/cics-crucible/schema/expected.schema.json",
  "title": "cics-crucible expected event log (format cics-crucible/expected/1)",
  "type": "object",
  "required": ["format", "case", "scenario", "tasks"],
  "additionalProperties": false,
  "properties": {
    "format": {"const": "cics-crucible/expected/1"},
    "case": {"type": "string"},
    "scenario": {"type": "string"},
    "tasks": {"type": "array", "minItems": 1, "items": {"$ref": "#/$defs/task"}},
    "final": {
      "type": "object",
      "additionalProperties": false,
      "properties": {
        "ts_queues": {"type": "object", "additionalProperties": {"type": "array", "items": {"$ref": "#/$defs/tsitem"}}},
        "td_queues": {"type": "object", "propertyNames": {"$ref": "#/$defs/name4"}, "additionalProperties": {"type": "array", "items": {"$ref": "#/$defs/tsitem"}}},
        "files": {"type": "object", "propertyNames": {"$ref": "#/$defs/name8"}, "additionalProperties": {"type": "array", "items": {"type": "string"}}}
      }
    }
  },
  "$defs": {
    "timestamp": {"type": "string", "pattern": "^\\d{4}-\\d{2}-\\d{2}T\\d{2}:\\d{2}:\\d{2}$"},
    "name4": {"type": "string", "pattern": "^[A-Z0-9#@$]{1,4}$"},
    "name8": {"type": "string", "pattern": "^[A-Z0-9#@$]{1,8}$"},
    "channel": {"type": "string", "pattern": "^[A-Z0-9]{1,16}$"},
    "hms": {"type": "string", "pattern": "^\\d{6}$"},
    "hex": {"type": "object", "required": ["hex"], "additionalProperties": false,
            "properties": {"hex": {"type": "string", "pattern": "^([0-9A-F]{2})*$"}}},
    "text_or_hex": {"oneOf": [{"type": "string"}, {"$ref": "#/$defs/hex"}]},
    "tsitem": {"$ref": "#/$defs/text_or_hex"},
    "cond": {"type": "string", "pattern": "^[A-Z0-9]+$"},
    "area": {
      "oneOf": [
        {"type": "object", "required": ["length", "layout", "fields"], "additionalProperties": false,
         "properties": {"length": {"type": "integer", "minimum": 0}, "layout": {"type": "string"},
                        "fields": {"type": "object", "additionalProperties": {"$ref": "#/$defs/text_or_hex"}}}},
        {"type": "object", "required": ["length", "text"], "additionalProperties": false,
         "properties": {"length": {"type": "integer", "minimum": 0}, "text": {"type": "string"}}},
        {"type": "object", "required": ["length", "hex"], "additionalProperties": false,
         "properties": {"length": {"type": "integer", "minimum": 0}, "hex": {"type": "string", "pattern": "^([0-9A-F]{2})*$"}}}
      ]
    },
    "area_or_null": {"oneOf": [{"type": "null"}, {"$ref": "#/$defs/area"}]},
    "trigger": {
      "oneOf": [
        {"type": "object", "required": ["kind", "step"], "additionalProperties": false,
         "properties": {"kind": {"const": "terminal"}, "step": {"type": "integer", "minimum": 0}}},
        {"type": "object", "required": ["kind", "task", "event"], "additionalProperties": false,
         "properties": {"kind": {"enum": ["start", "run", "immediate"]}, "task": {"type": "integer", "minimum": 1},
                        "event": {"type": "integer", "minimum": 0}}},
        {"type": "object", "required": ["kind", "request"], "additionalProperties": false,
         "properties": {"kind": {"const": "http"}, "request": {"type": "integer", "minimum": 0}}}
      ]
    },
    "task": {
      "type": "object",
      "required": ["seq", "transid", "program", "termid", "at", "trigger", "eibaid", "eibcalen", "commarea", "events", "end"],
      "additionalProperties": false,
      "properties": {
        "seq": {"type": "integer", "minimum": 1},
        "transid": {"$ref": "#/$defs/name4"},
        "program": {"$ref": "#/$defs/name8"},
        "termid": {"oneOf": [{"type": "null"}, {"$ref": "#/$defs/name4"}]},
        "at": {"$ref": "#/$defs/timestamp"},
        "trigger": {"$ref": "#/$defs/trigger"},
        "eibaid": {"oneOf": [{"type": "null"}, {"type": "string", "pattern": "^(ENTER|CLEAR|PA[1-3]|PF([1-9]|1[0-9]|2[0-4]))$"}]},
        "eibcalen": {"type": "integer", "minimum": 0},
        "commarea": {"$ref": "#/$defs/area_or_null"},
        "events": {"type": "array", "minItems": 1, "items": {"$ref": "#/$defs/event"}},
        "end": {"enum": ["normal", "abend"]},
        "note": {"type": "string"}
      }
    },
    "options": {"type": "array", "items": {"enum": ["ERASE", "ERASEAUP", "MAPONLY", "DATAONLY", "FREEKB", "ALARM", "FRSET", "CURSOR", "WAIT", "LAST"]}},
    "fieldout": {
      "type": "object",
      "required": ["attr", "attr_from", "data", "data_from"],
      "additionalProperties": false,
      "properties": {
        "attr": {"oneOf": [{"type": "null"}, {"type": "string", "pattern": "^[0-9A-F]{2}$"}]},
        "attr_from": {"enum": ["program", "map", "none"]},
        "meaning": {
          "type": "object",
          "required": ["protected", "numeric", "display", "mdt"],
          "additionalProperties": false,
          "properties": {
            "protected": {"type": "boolean"}, "numeric": {"type": "boolean"},
            "display": {"enum": ["normal", "bright", "dark"]}, "mdt": {"type": "boolean"}
          }
        },
        "data": {"oneOf": [{"type": "null"}, {"$ref": "#/$defs/text_or_hex"}]},
        "data_from": {"enum": ["program", "map", "none"]},
        "color": {"oneOf": [{"type": "null"}, {"type": "string", "pattern": "^[0-9A-F]{2}$"}]},
        "color_from": {"enum": ["program", "map", "none"]},
        "hilight": {"oneOf": [{"type": "null"}, {"type": "string", "pattern": "^[0-9A-F]{2}$"}]},
        "hilight_from": {"enum": ["program", "map", "none"]},
        "note": {"type": "string"}
      }
    },
    "event": {
      "oneOf": [
        {"type": "object", "required": ["event", "program", "map", "mapset", "options", "fields"], "additionalProperties": false,
         "properties": {"event": {"const": "SEND-MAP"}, "program": {"$ref": "#/$defs/name8"},
                        "map": {"$ref": "#/$defs/name8"}, "mapset": {"$ref": "#/$defs/name8"},
                        "options": {"$ref": "#/$defs/options"},
                        "cursor": {"oneOf": [{"type": "string"}, {"type": "object", "required": ["offset"], "additionalProperties": false, "properties": {"offset": {"type": "integer", "minimum": 0}}}]},
                        "fields": {"type": "object", "additionalProperties": {"$ref": "#/$defs/fieldout"}},
                        "note": {"type": "string"}}},
        {"type": "object", "required": ["event", "program", "text", "length", "options"], "additionalProperties": false,
         "properties": {"event": {"const": "SEND-TEXT"}, "program": {"$ref": "#/$defs/name8"},
                        "text": {"$ref": "#/$defs/text_or_hex"}, "length": {"type": "integer", "minimum": 0},
                        "options": {"$ref": "#/$defs/options"}, "note": {"type": "string"}}},
        {"type": "object", "required": ["event", "program", "options"], "additionalProperties": false,
         "properties": {"event": {"const": "SEND-CONTROL"}, "program": {"$ref": "#/$defs/name8"},
                        "options": {"$ref": "#/$defs/options"},
                        "cursor": {"type": "object", "required": ["offset"], "additionalProperties": false, "properties": {"offset": {"type": "integer", "minimum": 0}}},
                        "note": {"type": "string"}}},
        {"type": "object", "required": ["event", "program", "map", "mapset", "resp"], "additionalProperties": false,
         "properties": {"event": {"const": "RECEIVE-MAP"}, "program": {"$ref": "#/$defs/name8"},
                        "map": {"$ref": "#/$defs/name8"}, "mapset": {"$ref": "#/$defs/name8"},
                        "resp": {"$ref": "#/$defs/cond"}, "note": {"type": "string"}}},
        {"type": "object", "required": ["event", "program", "resp", "length", "data"], "additionalProperties": false,
         "properties": {"event": {"const": "RECEIVE"}, "program": {"$ref": "#/$defs/name8"},
                        "resp": {"$ref": "#/$defs/cond"}, "length": {"type": "integer", "minimum": 0},
                        "data": {"$ref": "#/$defs/area_or_null"}, "note": {"type": "string"}}},
        {"type": "object", "required": ["event", "program", "target", "length", "commarea", "resp"], "additionalProperties": false,
         "properties": {"event": {"const": "LINK"}, "program": {"$ref": "#/$defs/name8"},
                        "target": {"$ref": "#/$defs/name8"}, "length": {"type": "integer", "minimum": 0},
                        "commarea": {"$ref": "#/$defs/area_or_null"}, "resp": {"$ref": "#/$defs/cond"},
                        "resp2": {"type": "integer"}, "note": {"type": "string"}}},
        {"type": "object", "required": ["event", "program", "target", "length", "commarea", "resp"], "additionalProperties": false,
         "properties": {"event": {"const": "XCTL"}, "program": {"$ref": "#/$defs/name8"},
                        "target": {"$ref": "#/$defs/name8"}, "length": {"type": "integer", "minimum": 0},
                        "commarea": {"$ref": "#/$defs/area_or_null"}, "resp": {"$ref": "#/$defs/cond"},
                        "resp2": {"type": "integer"}, "note": {"type": "string"}}},
        {"type": "object", "required": ["event", "program", "level"], "additionalProperties": false,
         "properties": {"event": {"const": "RETURN"}, "program": {"$ref": "#/$defs/name8"},
                        "level": {"type": "integer", "minimum": 1},
                        "transid": {"oneOf": [{"type": "null"}, {"$ref": "#/$defs/name4"}]},
                        "commarea": {"$ref": "#/$defs/area_or_null"},
                        "caller_commarea": {"$ref": "#/$defs/area_or_null"},
                        "immediate": {"const": true}, "channel": {"$ref": "#/$defs/channel"},
                        "resp": {"$ref": "#/$defs/cond"}, "resp2": {"type": "integer"}, "note": {"type": "string"}}},
        {"type": "object", "required": ["event", "program", "transid", "termid", "from", "protect", "resp", "expires"], "additionalProperties": false,
         "properties": {"event": {"const": "START"}, "program": {"$ref": "#/$defs/name8"},
                        "transid": {"$ref": "#/$defs/name4"},
                        "termid": {"oneOf": [{"type": "null"}, {"$ref": "#/$defs/name4"}]},
                        "interval": {"oneOf": [{"type": "null"}, {"$ref": "#/$defs/hms"}]},
                        "time": {"oneOf": [{"type": "null"}, {"$ref": "#/$defs/hms"}]},
                        "from": {"$ref": "#/$defs/area_or_null"}, "reqid": {"$ref": "#/$defs/name8"},
                        "rtransid": {"$ref": "#/$defs/name4"}, "rtermid": {"$ref": "#/$defs/name4"},
                        "queue": {"$ref": "#/$defs/name8"},
                        "protect": {"type": "boolean"}, "resp": {"$ref": "#/$defs/cond"},
                        "resp2": {"type": "integer"},
                        "expires": {"oneOf": [{"type": "null"}, {"$ref": "#/$defs/timestamp"}]},
                        "note": {"type": "string"}}},
        {"type": "object", "required": ["event", "program", "resp", "data"], "additionalProperties": false,
         "properties": {"event": {"const": "RETRIEVE"}, "program": {"$ref": "#/$defs/name8"},
                        "resp": {"$ref": "#/$defs/cond"}, "length": {"type": "integer", "minimum": 0},
                        "data": {"$ref": "#/$defs/area_or_null"},
                        "rtransid": {"$ref": "#/$defs/name4"}, "rtermid": {"$ref": "#/$defs/name4"},
                        "queue": {"$ref": "#/$defs/name8"}, "note": {"type": "string"}}},
        {"type": "object", "required": ["event", "program", "reqid", "resp"], "additionalProperties": false,
         "properties": {"event": {"const": "CANCEL"}, "program": {"$ref": "#/$defs/name8"},
                        "reqid": {"$ref": "#/$defs/name8"}, "resp": {"$ref": "#/$defs/cond"}, "note": {"type": "string"}}},
        {"type": "object", "required": ["event", "program", "transid", "resp"], "additionalProperties": false,
         "properties": {"event": {"const": "RUN"}, "program": {"$ref": "#/$defs/name8"},
                        "transid": {"$ref": "#/$defs/name4"}, "resp": {"$ref": "#/$defs/cond"},
                        "resp2": {"type": "integer"}, "note": {"type": "string"}}},
        {"type": "object", "required": ["event", "program", "queue", "item", "resp", "data"], "additionalProperties": false,
         "properties": {"event": {"const": "READQ-TS"}, "program": {"$ref": "#/$defs/name8"},
                        "queue": {"type": "string", "pattern": "^[A-Z0-9#@$]{1,16}$"},
                        "item": {"oneOf": [{"type": "integer", "minimum": 1}, {"const": "NEXT"}]},
                        "resp": {"$ref": "#/$defs/cond"}, "length": {"type": "integer", "minimum": 0},
                        "data": {"$ref": "#/$defs/area_or_null"}, "note": {"type": "string"}}},
        {"type": "object", "required": ["event", "program", "queue", "data", "resp", "item"], "additionalProperties": false,
         "properties": {"event": {"const": "WRITEQ-TS"}, "program": {"$ref": "#/$defs/name8"},
                        "queue": {"type": "string", "pattern": "^[A-Z0-9#@$]{1,16}$"},
                        "data": {"$ref": "#/$defs/area"}, "resp": {"$ref": "#/$defs/cond"},
                        "item": {"oneOf": [{"type": "null"}, {"type": "integer", "minimum": 1}]}, "note": {"type": "string"}}},
        {"type": "object", "required": ["event", "program", "queue", "resp", "data"], "additionalProperties": false,
         "properties": {"event": {"const": "READQ-TD"}, "program": {"$ref": "#/$defs/name8"},
                        "queue": {"$ref": "#/$defs/name4"}, "resp": {"$ref": "#/$defs/cond"},
                        "resp2": {"type": "integer"}, "length": {"type": "integer", "minimum": 0},
                        "data": {"$ref": "#/$defs/area_or_null"}, "note": {"type": "string"}}},
        {"type": "object", "required": ["event", "program", "queue", "data", "resp"], "additionalProperties": false,
         "properties": {"event": {"const": "WRITEQ-TD"}, "program": {"$ref": "#/$defs/name8"},
                        "queue": {"$ref": "#/$defs/name4"}, "data": {"$ref": "#/$defs/area"},
                        "resp": {"$ref": "#/$defs/cond"}, "resp2": {"type": "integer"}, "note": {"type": "string"}}},
        {"type": "object", "required": ["event", "program", "queue", "resp"], "additionalProperties": false,
         "properties": {"event": {"const": "DELETEQ-TD"}, "program": {"$ref": "#/$defs/name8"},
                        "queue": {"$ref": "#/$defs/name4"}, "resp": {"$ref": "#/$defs/cond"},
                        "resp2": {"type": "integer"}, "note": {"type": "string"}}},
        {"type": "object", "required": ["event", "program", "resp", "length", "data"], "additionalProperties": false,
         "properties": {"event": {"const": "WEB-RECEIVE"}, "program": {"$ref": "#/$defs/name8"},
                        "resp": {"$ref": "#/$defs/cond"}, "resp2": {"type": "integer"},
                        "length": {"type": "integer", "minimum": 0}, "data": {"$ref": "#/$defs/area_or_null"},
                        "note": {"type": "string"}}},
        {"type": "object", "required": ["event", "program", "status", "from", "resp"], "additionalProperties": false,
         "properties": {"event": {"const": "WEB-SEND"}, "program": {"$ref": "#/$defs/name8"},
                        "status": {"type": "integer", "minimum": 100, "maximum": 599},
                        "statustext": {"type": "string"}, "mediatype": {"type": "string", "minLength": 1},
                        "from": {"$ref": "#/$defs/area_or_null"},
                        "resp": {"$ref": "#/$defs/cond"}, "resp2": {"type": "integer"}, "note": {"type": "string"}}},
        {"type": "object", "required": ["event", "program", "data", "resp"], "additionalProperties": false,
         "properties": {"event": {"const": "WRITE-OPERATOR"}, "program": {"$ref": "#/$defs/name8"},
                        "data": {"$ref": "#/$defs/area"}, "resp": {"$ref": "#/$defs/cond"}, "note": {"type": "string"}}},
        {"type": "object", "required": ["event", "program", "file", "ridfld", "resp"], "additionalProperties": false,
         "properties": {"event": {"const": "READ"}, "program": {"$ref": "#/$defs/name8"},
                        "file": {"$ref": "#/$defs/name8"}, "ridfld": {"$ref": "#/$defs/text_or_hex"},
                        "update": {"type": "boolean"}, "resp": {"$ref": "#/$defs/cond"}, "resp2": {"type": "integer"},
                        "length": {"type": "integer", "minimum": 0}, "data": {"$ref": "#/$defs/area_or_null"},
                        "note": {"type": "string"}}},
        {"type": "object", "required": ["event", "program", "file", "data", "resp"], "additionalProperties": false,
         "properties": {"event": {"const": "REWRITE"}, "program": {"$ref": "#/$defs/name8"},
                        "file": {"$ref": "#/$defs/name8"}, "data": {"$ref": "#/$defs/area"},
                        "resp": {"$ref": "#/$defs/cond"}, "resp2": {"type": "integer"}, "note": {"type": "string"}}},
        {"type": "object", "required": ["event", "program", "file", "resp"], "additionalProperties": false,
         "properties": {"event": {"const": "UNLOCK"}, "program": {"$ref": "#/$defs/name8"},
                        "file": {"$ref": "#/$defs/name8"}, "resp": {"$ref": "#/$defs/cond"},
                        "resp2": {"type": "integer"}, "note": {"type": "string"}}},
        {"type": "object", "required": ["event", "program", "abcode", "cause", "outcome"], "additionalProperties": false,
         "properties": {"event": {"const": "ABEND"}, "program": {"$ref": "#/$defs/name8"},
                        "abcode": {"type": "string", "pattern": "^[A-Z0-9#@$]{4}$"},
                        "cause": {"enum": ["command", "condition", "system"]}, "condition": {"$ref": "#/$defs/cond"},
                        "outcome": {"enum": ["terminated", "exit"]},
                        "exit": {"type": "object", "required": ["program", "label"], "additionalProperties": false,
                                 "properties": {"program": {"$ref": "#/$defs/name8"}, "label": {"type": "string"}}},
                        "note": {"type": "string"}}}
      ]
    }
  }
}
