{
 "format": "cics-crucible/expected/1",
 "case": "pc-aid-menu",
 "scenario": "option1-xctl",
 "tasks": [
  {
   "seq": 1,
   "transid": "PC11",
   "program": "PCMENU",
   "termid": "T001",
   "at": "2026-03-02T10:00:00",
   "trigger": {
    "kind": "terminal",
    "step": 0
   },
   "eibaid": "ENTER",
   "eibcalen": 0,
   "commarea": null,
   "events": [
    {
     "event": "SEND-MAP",
     "program": "PCMENU",
     "map": "PCMN",
     "mapset": "PCSET2",
     "options": [
      "ERASE"
     ],
     "cursor": "OPT",
     "fields": {
      "OPT": {
       "attr": "C1",
       "attr_from": "map",
       "meaning": {
        "protected": false,
        "numeric": false,
        "display": "normal",
        "mdt": true
       },
       "data": null,
       "data_from": "none",
       "note": "ATTRB=(UNPROT,NORM,IC,FSET): always transmitted, so RECEIVE MAP never gets MAPFAIL on ENTER/PF keys"
      },
      "VISITS": {
       "attr": "F0",
       "attr_from": "map",
       "data": "0001",
       "data_from": "program"
      },
      "MSG": {
       "attr": "F0",
       "attr_from": "map",
       "data": "WELCOME",
       "data_from": "program"
      }
     }
    },
    {
     "event": "RETURN",
     "program": "PCMENU",
     "level": 1,
     "transid": "PC11",
     "commarea": {
      "length": 10,
      "layout": "MENUCA",
      "fields": {
       "MN-VISITS": "1",
       "MN-LAST": "",
       "MN-FLAG": ""
      }
     }
    }
   ],
   "end": "normal"
  },
  {
   "seq": 2,
   "transid": "PC11",
   "program": "PCMENU",
   "termid": "T001",
   "at": "2026-03-02T10:00:10",
   "trigger": {
    "kind": "terminal",
    "step": 1
   },
   "eibaid": "ENTER",
   "eibcalen": 10,
   "commarea": {
    "length": 10,
    "layout": "MENUCA",
    "fields": {
     "MN-VISITS": "1",
     "MN-LAST": "",
     "MN-FLAG": ""
    }
   },
   "events": [
    {
     "event": "RECEIVE-MAP",
     "program": "PCMENU",
     "map": "PCMN",
     "mapset": "PCSET2",
     "resp": "NORMAL"
    },
    {
     "event": "XCTL",
     "program": "PCMENU",
     "target": "PCDETL",
     "length": 10,
     "resp": "NORMAL",
     "commarea": {
      "length": 10,
      "layout": "MENUCA",
      "fields": {
       "MN-VISITS": "2",
       "MN-LAST": "PC11",
       "MN-FLAG": ""
      }
     }
    },
    {
     "event": "SEND-MAP",
     "program": "PCDETL",
     "map": "PCDT",
     "mapset": "PCSET2",
     "options": [
      "ERASE"
     ],
     "fields": {
      "DVISITS": {
       "attr": "F0",
       "attr_from": "map",
       "data": "0002",
       "data_from": "program"
      },
      "DLAST": {
       "attr": "F0",
       "attr_from": "map",
       "data": "PC11",
       "data_from": "program"
      },
      "DTRAN": {
       "attr": "F0",
       "attr_from": "map",
       "data": "PC11",
       "data_from": "program",
       "note": "EIBTRNID"
      },
      "DMSG": {
       "attr": "F0",
       "attr_from": "map",
       "data": "ENTER RETURNS TO THE MENU",
       "data_from": "program"
      }
     }
    },
    {
     "event": "RETURN",
     "program": "PCDETL",
     "level": 1,
     "transid": "PC11",
     "commarea": null,
     "note": "no COMMAREA: the next PC11 task has EIBCALEN 0"
    }
   ],
   "end": "normal"
  },
  {
   "seq": 3,
   "transid": "PC11",
   "program": "PCMENU",
   "termid": "T001",
   "at": "2026-03-02T10:00:20",
   "trigger": {
    "kind": "terminal",
    "step": 2
   },
   "eibaid": "ENTER",
   "eibcalen": 0,
   "commarea": null,
   "events": [
    {
     "event": "SEND-MAP",
     "program": "PCMENU",
     "map": "PCMN",
     "mapset": "PCSET2",
     "options": [
      "ERASE"
     ],
     "cursor": "OPT",
     "fields": {
      "OPT": {
       "attr": "C1",
       "attr_from": "map",
       "meaning": {
        "protected": false,
        "numeric": false,
        "display": "normal",
        "mdt": true
       },
       "data": null,
       "data_from": "none",
       "note": "ATTRB=(UNPROT,NORM,IC,FSET): always transmitted, so RECEIVE MAP never gets MAPFAIL on ENTER/PF keys"
      },
      "VISITS": {
       "attr": "F0",
       "attr_from": "map",
       "data": "0001",
       "data_from": "program"
      },
      "MSG": {
       "attr": "F0",
       "attr_from": "map",
       "data": "WELCOME",
       "data_from": "program"
      }
     }
    },
    {
     "event": "RETURN",
     "program": "PCMENU",
     "level": 1,
     "transid": "PC11",
     "commarea": {
      "length": 10,
      "layout": "MENUCA",
      "fields": {
       "MN-VISITS": "1",
       "MN-LAST": "",
       "MN-FLAG": ""
      }
     }
    }
   ],
   "end": "normal"
  }
 ]
}
