{
 "format": "cics-crucible/expected/1",
 "case": "hc-file-unlock",
 "scenario": "unlock-nothing",
 "tasks": [
  {
   "seq": 1,
   "transid": "HC81",
   "program": "HCUNLK",
   "termid": "T001",
   "at": "2026-03-02T10:00:00",
   "trigger": {
    "kind": "terminal",
    "step": 0
   },
   "eibaid": "ENTER",
   "eibcalen": 0,
   "commarea": null,
   "events": [
    {
     "event": "RECEIVE",
     "program": "HCUNLK",
     "resp": "NORMAL",
     "length": 6,
     "data": {
      "length": 6,
      "text": "HC81 N"
     }
    },
    {
     "event": "UNLOCK",
     "program": "HCUNLK",
     "file": "HCUF",
     "resp": "NORMAL"
    },
    {
     "event": "WRITEQ-TS",
     "program": "HCUNLK",
     "queue": "HCLOG",
     "data": {
      "length": 33,
      "text": "N1  R=00 S=000 D=                "
     },
     "resp": "NORMAL",
     "item": 1
    },
    {
     "event": "REWRITE",
     "program": "HCUNLK",
     "file": "HCUF",
     "data": {
      "length": 16,
      "text": "K001ALPHA   0099"
     },
     "resp": "INVREQ",
     "resp2": 30
    },
    {
     "event": "WRITEQ-TS",
     "program": "HCUNLK",
     "queue": "HCLOG",
     "data": {
      "length": 33,
      "text": "N2  R=16 S=030 D=                "
     },
     "resp": "NORMAL",
     "item": 2
    },
    {
     "event": "READ",
     "program": "HCUNLK",
     "file": "HCUF",
     "ridfld": "K001",
     "resp": "NORMAL",
     "length": 16,
     "data": {
      "length": 16,
      "text": "K001ALPHA   0010"
     }
    },
    {
     "event": "WRITEQ-TS",
     "program": "HCUNLK",
     "queue": "HCLOG",
     "data": {
      "length": 33,
      "text": "N3  R=00 S=000 D=K001ALPHA   0010"
     },
     "resp": "NORMAL",
     "item": 3
    },
    {
     "event": "SEND-TEXT",
     "program": "HCUNLK",
     "text": "DONE OK",
     "length": 8,
     "options": [
      "ERASE"
     ]
    },
    {
     "event": "RETURN",
     "program": "HCUNLK",
     "level": 1,
     "transid": null,
     "commarea": null
    }
   ],
   "end": "normal"
  }
 ],
 "final": {
  "ts_queues": {
   "HCLOG": [
    "N1  R=00 S=000 D=                ",
    "N2  R=16 S=030 D=                ",
    "N3  R=00 S=000 D=K001ALPHA   0010"
   ]
  },
  "files": {
   "HCUF": [
    "K001ALPHA   0010",
    "K002BRAVO   0020",
    "K003CHARLIE 0030"
   ]
  }
 }
}
