{
 "format": "cics-crucible/expected/1",
 "case": "gt-start-options",
 "scenario": "data-options",
 "tasks": [
  {
   "seq": 1,
   "transid": "GT21",
   "program": "GTOPTS",
   "termid": "T001",
   "at": "2026-03-02T10:00:00",
   "trigger": {
    "kind": "terminal",
    "step": 0
   },
   "eibaid": "ENTER",
   "eibcalen": 0,
   "commarea": null,
   "events": [
    {
     "event": "RECEIVE",
     "program": "GTOPTS",
     "resp": "NORMAL",
     "length": 6,
     "data": {
      "length": 6,
      "text": "GT21 D"
     }
    },
    {
     "event": "START",
     "program": "GTOPTS",
     "transid": "GT22",
     "termid": null,
     "interval": "000000",
     "from": {
      "length": 20,
      "text": "ORDER 0021 READY"
     },
     "rtransid": "GT21",
     "rtermid": "T001",
     "queue": "GTQUEUE1",
     "protect": false,
     "resp": "NORMAL",
     "expires": "2026-03-02T10:00:00"
    },
    {
     "event": "SEND-TEXT",
     "program": "GTOPTS",
     "text": "STARTS ISSUED",
     "length": 20,
     "options": [
      "ERASE"
     ]
    },
    {
     "event": "RETURN",
     "program": "GTOPTS",
     "level": 1,
     "transid": null,
     "commarea": null
    }
   ],
   "end": "normal"
  },
  {
   "seq": 2,
   "transid": "GT22",
   "program": "GTREAD",
   "termid": null,
   "at": "2026-03-02T10:00:00",
   "trigger": {
    "kind": "start",
    "task": 1,
    "event": 1
   },
   "eibaid": null,
   "eibcalen": 0,
   "commarea": null,
   "events": [
    {
     "event": "RETRIEVE",
     "program": "GTREAD",
     "resp": "NORMAL",
     "length": 20,
     "data": {
      "length": 20,
      "text": "ORDER 0021 READY"
     },
     "rtransid": "GT21",
     "rtermid": "T001",
     "queue": "GTQUEUE1"
    },
    {
     "event": "WRITEQ-TS",
     "program": "GTREAD",
     "queue": "GTLOG",
     "data": {
      "length": 59,
      "text": "R=00 L=0020 T=GT21 M=T001 Q=GTQUEUE1 D=ORDER 0021 READY"
     },
     "resp": "NORMAL",
     "item": 1
    },
    {
     "event": "RETURN",
     "program": "GTREAD",
     "level": 1,
     "transid": null,
     "commarea": null
    }
   ],
   "end": "normal"
  }
 ],
 "final": {
  "ts_queues": {
   "GTLOG": [
    "R=00 L=0020 T=GT21 M=T001 Q=GTQUEUE1 D=ORDER 0021 READY"
   ]
  }
 }
}
